text,author,score,is_op,submission_id,subreddit,subreddit_id,comment_id
Very cool story,letsgoabbey,5,False,14828yd,r/scarystories,t5_2rrzd,jnyiaea
She's using her skills.,monkner,1,False,14828yd,r/scarystories,t5_2rrzd,jnysmzi
Nice,Deb6691,1,False,14828yd,r/scarystories,t5_2rrzd,jnyvqfc
"Kiss of death, nice.",TXJOEMAMA,1,False,14828yd,r/scarystories,t5_2rrzd,jo01y4x
Well done. Engaging story.,Quickhidemeplease,1,False,14828yd,r/scarystories,t5_2rrzd,jo15o93
holy crap!! i love this sm,julesisgayasf,1,False,14828yd,r/scarystories,t5_2rrzd,jo1icjb
Slow clap. Well done.,Impossible_Balance11,1,False,14828yd,r/scarystories,t5_2rrzd,jo2lpzc
Making lemonade from lemons😉,Stranger_at_Night,1,False,14828yd,r/scarystories,t5_2rrzd,jo47rsf
Nice!,ThrowAway072343,0,False,14828yd,r/scarystories,t5_2rrzd,jny4dqi
"Thank you, I'm glad you enjoyed it.",1000andonenites,3,True,14828yd,r/scarystories,t5_2rrzd,jnz9x5y
As she should!. Thanks for leaving a comment.,1000andonenites,2,True,14828yd,r/scarystories,t5_2rrzd,jnz9wcf
Thank you! I'm glad you enjoyed it.,1000andonenites,1,True,14828yd,r/scarystories,t5_2rrzd,jnz9vco
Thank you so much 😀,1000andonenites,2,True,14828yd,r/scarystories,t5_2rrzd,jo1a0c5
Thank you!,1000andonenites,1,True,14828yd,r/scarystories,t5_2rrzd,jo2tkmq
I'm glad you enjoyed it 😀,1000andonenites,1,True,14828yd,r/scarystories,t5_2rrzd,jo2tl7e
"Thank you, I appreciate you reading my story and leaving a comment!",1000andonenites,2,True,14828yd,r/scarystories,t5_2rrzd,jny8bi2
I look forward to reading more!,ThrowAway072343,1,False,14828yd,r/scarystories,t5_2rrzd,jny8pux
Thanks! That makes me very happy :) I have tons of stories on shortscarystories but they are dark now. Hopefully when the sub is back up and running I'll be posting regularly.,1000andonenites,5,True,14828yd,r/scarystories,t5_2rrzd,jny9gp1
"I'm following you, so I won't miss anything new and I can go back and look!  Keep writing!",ThrowAway072343,1,False,14828yd,r/scarystories,t5_2rrzd,jny9opm
I hope to 😀,1000andonenites,2,True,14828yd,r/scarystories,t5_2rrzd,jnyhe66
